{
  "$schema": "http://json-schema.org/draft-06/schema#",
  "definitions": {},
  "id": "Attachment",
  "items": {
    "id": "/items",
    "properties": {
      "actions": {
        "id": "/items/properties/actions",
        "items": {
          "id": "/items/properties/actions/items",
          "properties": {
            "name": {
              "id": "/items/properties/actions/items/properties/name",
              "type": "string"
            },
            "text": {
              "id": "/items/properties/actions/items/properties/text",
              "type": "string"
            },
            "type": {
              "id": "/items/properties/actions/items/properties/type",
              "type": "string"
            },
            "value": {
              "id": "/items/properties/actions/items/properties/value",
              "type": "string"
            }
          },
          "type": "object"
        },
        "type": "array"
      },
      "author_icon": {
        "id": "/items/properties/author_icon",
        "type": "string"
      },
      "author_link": {
        "id": "/items/properties/author_link",
        "type": "string"
      },
      "author_name": {
        "id": "/items/properties/author_name",
        "type": "string"
      },
      "color": {
        "id": "/items/properties/color",
        "type": "string"
      },
      "callback_id": {
        "id": "/items/properties/callback_id",
        "type": "string"
      },
      "fallback": {
        "id": "/items/properties/fallback",
        "type": "string"
      },
      "fields": {
        "id": "/items/properties/fields",
        "items": {
          "id": "/items/properties/fields/items",
          "properties": {
            "short": {
              "id": "/items/properties/fields/items/properties/short",
              "type": "boolean"
            },
            "title": {
              "id": "/items/properties/fields/items/properties/title",
              "type": "string"
            },
            "value": {
              "id": "/items/properties/fields/items/properties/value",
              "type": "string"
            }
          },
          "type": "object"
        },
        "type": "array"
      },
      "footer": {
        "id": "/items/properties/footer",
        "type": "string"
      },
      "footer_icon": {
        "id": "/items/properties/footer_icon",
        "type": "string"
      },
      "image_url": {
        "id": "/items/properties/image_url",
        "type": "string"
      },
      "mrkdwn_in": {
        "id": "/items/properties/mrkdwn_in",
        "items": {
          "id": "/items/properties/mrkdwn_in/items",
          "type": "string"
        },
        "type": "array"
      },
      "pretext": {
        "id": "/items/properties/pretext",
        "type": "string"
      },
      "text": {
        "id": "/items/properties/text",
        "type": "string"
      },
      "thumb_url": {
        "id": "/items/properties/thumb_url",
        "type": "string"
      },
      "title": {
        "id": "/items/properties/title",
        "type": "string"
      },
      "title_link": {
        "id": "/items/properties/title_link",
        "type": "string"
      },
      "ts": {
        "id": "/items/properties/ts",
        "type": "integer"
      }
    },
    "type": "object"
  },
  "type": "array"
}