[
  {
    "fallback": "Required plain-text summary of the attachment.",
    "color": "#36a64f",
    "pretext": "Optional text that appears above the attachment block",
    "author_name": "Bobby Tables",
    "author_link": "http://flickr.com/bobby/",
    "author_icon": "http://flickr.com/icons/bobby.jpg",
    "title": "Slack API Documentation",
    "title_link": "https://api.slack.com/",
    "text": "Optional text that appears within the attachment",
    "mrkdwn_in": [
      "text",
      "pretext"
    ],
    "fields": [
      {
        "title": "Priority",
        "value": "High",
        "short": false
      }
    ],
    "actions": [
      {
        "name": "game",
        "text": "Chess",
        "type": "button",
        "value": "chess"
      },
      {
        "name": "game",
        "text": "Falken's Maze",
        "type": "button",
        "value": "maze"
      },
      {
        "name": "game",
        "text": "Thermonuclear War",
        "style": "danger",
        "type": "button",
        "value": "war",
        "confirm": {
          "title": "Are you sure?",
          "text": "Wouldn't you prefer a good game of chess?",
          "ok_text": "Yes",
          "dismiss_text": "No"
        }
      },
      {
        "name": "games_list",
        "text": "Pick a game...",
        "type": "select",
        "options": [
          {
            "text": "Hearts",
            "value": "hearts"
          },
          {
            "text": "Bridge",
            "value": "bridge"
          },
          {
            "text": "Checkers",
            "value": "checkers"
          },
          {
            "text": "Chess",
            "value": "chess"
          },
          {
            "text": "Poker",
            "value": "poker"
          },
          {
            "text": "Falken's Maze",
            "value": "maze"
          },
          {
            "text": "Global Thermonuclear War",
            "value": "war"
          }
        ]
      }
    ],
    "image_url": "http://my-website.com/path/to/image.jpg",
    "thumb_url": "http://example.com/path/to/thumb.png",
    "footer": "Slack API",
    "footer_icon": "https://platform.slack-edge.com/img/default_application_icon.png",
    "ts": 123456789
  }
]